{
  "artifactDescriptors": [
    {
      "artifactType": "application/vnd.openpacker.tool.v1+tar+gzip",
      "descriptorId": "fixture-tool",
      "digest": {
        "algorithm": "sha256",
        "value": "50da97e9e1fb0f5a99586d514029af0efab48771e4d49d1e4d966d85b4a72447"
      },
      "extensions": {
        "org.openpacker.mise": { "executables": ["bin/openpacker-demo"] }
      },
      "externalRefs": [],
      "fileName": "openpacker-demo.tar.gz",
      "locations": [
        {
          "priority": 0,
          "rangeSupported": false,
          "transport": "file",
          "uri": "file:///OPENPACKER_DEMO_OUTPUT/openpacker-demo.tar.gz"
        }
      ],
      "mediaType": "application/gzip",
      "nativeRole": "tool-payload",
      "referrers": [],
      "size": 135
    },
    {
      "artifactType": "application/vnd.openpacker.npm.package.v1",
      "descriptorId": "pkg:npm/%40openpacker/demo-tool@1.0.0",
      "digest": {
        "algorithm": "sha256",
        "value": "947191caee6e8583baf6ce1e8471d2833ced146dfc4fc519530afcc478cd0a9b"
      },
      "externalRefs": [],
      "fileName": "npm-demo-1.0.0.native-bytes",
      "locations": [],
      "mediaType": "application/vnd.npm.package+gzip",
      "nativeRole": "native-package",
      "referrers": [],
      "size": 3095
    },
    {
      "artifactType": "application/vnd.openpacker.cargo.package.v1",
      "descriptorId": "pkg:cargo/openpacker-zstd-wasm@1.0.0",
      "digest": {
        "algorithm": "sha256",
        "value": "cfc5e7e4631edef5c9f25d862f084e733fe85f5103024abec549fc5bf5613fb4"
      },
      "externalRefs": [],
      "fileName": "cargo-zstd-wasm-1.0.0.native-bytes",
      "locations": [],
      "mediaType": "application/vnd.crates.io.crate+gzip",
      "nativeRole": "native-package",
      "referrers": [],
      "size": 3095
    },
    {
      "artifactType": "application/vnd.openpacker.nuget.package.v1",
      "descriptorId": "pkg:nuget/OpenPacker.Zstd.Tool@1.0.0",
      "digest": {
        "algorithm": "sha256",
        "value": "3559e6f2da525be1746a1f686e5485d974b468f6a7e4dbcd02ae0eec9c4760ee"
      },
      "externalRefs": [],
      "fileName": "nuget-zstd-tool-1.0.0.native-bytes",
      "locations": [],
      "mediaType": "application/vnd.nuget.package+zip",
      "nativeRole": "native-package",
      "referrers": [],
      "size": 791
    }
  ],
  "dependencyEdges": [
    {
      "fromNodeId": "root",
      "requirementId": "root-capability",
      "toNodeId": "sha256:24faa1c2a2d0ddce2a8d1a99449a048b671baab4a231940826f56a05f899347c",
      "witnessType": "capability"
    },
    {
      "fromNodeId": "root",
      "requirementId": "root-nuget",
      "toNodeId": "sha256:8879bdfdc453e74997664012b88315b7b03f5b6c22349ec048db1599de2678a0",
      "witnessType": "package"
    },
    {
      "fromNodeId": "root",
      "requirementId": "root-tool",
      "toNodeId": "sha256:a9ec3147fae3bd774345ea614d7f982bb72941e6adf775392e87a766d5b280b9",
      "witnessType": "package"
    },
    {
      "fromNodeId": "sha256:24faa1c2a2d0ddce2a8d1a99449a048b671baab4a231940826f56a05f899347c",
      "requirementId": "sha256:24faa1c2a2d0ddce2a8d1a99449a048b671baab4a231940826f56a05f899347c:r0",
      "toNodeId": "sha256:de79503901b7a0fd0527201801ee46e393c6a1e2523d98dde036608054fb3528",
      "witnessType": "package"
    },
    {
      "fromNodeId": "sha256:8879bdfdc453e74997664012b88315b7b03f5b6c22349ec048db1599de2678a0",
      "requirementId": "sha256:8879bdfdc453e74997664012b88315b7b03f5b6c22349ec048db1599de2678a0:r0",
      "toNodeId": "sha256:8d4533757e71570f92901004cce0342a686f8d11b63860a0d963bb1ac8b76cdb",
      "witnessType": "package"
    },
    {
      "fromNodeId": "sha256:a9ec3147fae3bd774345ea614d7f982bb72941e6adf775392e87a766d5b280b9",
      "requirementId": "sha256:a9ec3147fae3bd774345ea614d7f982bb72941e6adf775392e87a766d5b280b9:r0",
      "toNodeId": "sha256:24faa1c2a2d0ddce2a8d1a99449a048b671baab4a231940826f56a05f899347c",
      "witnessType": "package"
    },
    {
      "fromNodeId": "sha256:a9ec3147fae3bd774345ea614d7f982bb72941e6adf775392e87a766d5b280b9",
      "requirementId": "sha256:a9ec3147fae3bd774345ea614d7f982bb72941e6adf775392e87a766d5b280b9:r1",
      "toNodeId": "sha256:24faa1c2a2d0ddce2a8d1a99449a048b671baab4a231940826f56a05f899347c",
      "witnessType": "capability"
    },
    {
      "fromNodeId": "sha256:a9ec3147fae3bd774345ea614d7f982bb72941e6adf775392e87a766d5b280b9",
      "requirementId": "sha256:a9ec3147fae3bd774345ea614d7f982bb72941e6adf775392e87a766d5b280b9:r2",
      "toNodeId": "sha256:23b9e4b352c39e365046e4968bc93f61be544599f8c35d70ba6becf71ece187d",
      "witnessType": "package"
    }
  ],
  "externalRefs": [],
  "lifecycleRoot": {
    "algorithm": "sha256",
    "value": "4f53cda18c2baa0c0354bb5f9a3ecbe5ed12ab4d8e11ba873c2f11161202b945"
  },
  "objectiveOrdering": [
    "satisfy-hard-constraints",
    "minimize-package-count",
    "exclude-lifecycle-denied",
    "prefer-stable",
    "prefer-highest-native-version",
    "canonical-lexical-tie-break"
  ],
  "ocmReferences": [],
  "policyDigest": {
    "algorithm": "sha256",
    "value": "088b8de1f381ea7aa9d3867f43771d73b3ac972e100ce6fb6b10ee65e3e6ccaf"
  },
  "protocolVersion": "1.0-draft",
  "receiptDigest": {
    "algorithm": "sha256",
    "value": "14677fd66d6a45461921ec02dc3bea53994b40c67b20afb24db242a8b868ac7f"
  },
  "rootRequirements": [
    {
      "authority": "test-fixture",
      "expression": {
        "purl": "pkg:npm/%40openpacker/demo-tool",
        "type": "package",
        "vers": "vers:npm/>=0.0.0|<2.0.0"
      },
      "id": "root-tool",
      "kind": "runtime",
      "optional": false,
      "semanticLoss": [],
      "source": {
        "type": "overlay",
        "uri": "https://openpacker.dev/fixtures/overlay"
      }
    },
    {
      "authority": "publisher",
      "expression": {
        "name": "compression/zstd",
        "type": "capability",
        "vers": "vers:generic/>=1"
      },
      "id": "root-capability",
      "kind": "runtime",
      "optional": false,
      "semanticLoss": [],
      "source": {
        "type": "overlay",
        "uri": "https://openpacker.dev/fixtures/overlay"
      }
    },
    {
      "authority": "test-fixture",
      "expression": {
        "purl": "pkg:nuget/openpacker.zstd.tool",
        "type": "package",
        "vers": "vers:nuget/>=1.0.0"
      },
      "id": "root-nuget",
      "kind": "tool",
      "optional": false,
      "semanticLoss": [],
      "source": {
        "type": "overlay",
        "uri": "https://openpacker.dev/fixtures/overlay"
      }
    }
  ],
  "schemaVersion": "1",
  "selectedExactPurls": [
    "pkg:cargo/openpacker-native-helper@1.0.0",
    "pkg:cargo/openpacker-zstd-wasm@1.0.0",
    "pkg:npm/%40openpacker/demo-tool@1.0.0",
    "pkg:npm/openpacker-native-helper@1.0.0",
    "pkg:nuget/openpacker.native.helper@1.0.0",
    "pkg:nuget/openpacker.zstd.tool@1.0.0"
  ],
  "semanticsProfile": "prex-calculus-subset-v1",
  "solutionDigest": {
    "algorithm": "sha256",
    "value": "0f89049e69954ab8525e15d69711570bc514254796b4a25eb02b578e88d66f18"
  },
  "sourceSnapshotDigests": [
    {
      "algorithm": "sha256",
      "value": "3f73545a379f09d516b0be18b5ea1225c5a54a1f5657ea6f74ef2a77305f1281"
    },
    {
      "algorithm": "sha256",
      "value": "3f73545a379f09d516b0be18b5ea1225c5a54a1f5657ea6f74ef2a77305f1281"
    },
    {
      "algorithm": "sha256",
      "value": "c2cc24a52f2eccfba614f45fc2f552ae633eec540ddb01640a5e16191fe6837f"
    },
    {
      "algorithm": "sha256",
      "value": "c2cc24a52f2eccfba614f45fc2f552ae633eec540ddb01640a5e16191fe6837f"
    },
    {
      "algorithm": "sha256",
      "value": "fc65f6fdb519bf1fb378e4fe9d40b06bc9276c5d2b0484c117fbd4e5ceca2cea"
    },
    {
      "algorithm": "sha256",
      "value": "fc65f6fdb519bf1fb378e4fe9d40b06bc9276c5d2b0484c117fbd4e5ceca2cea"
    }
  ],
  "target": {
    "abi": {},
    "architecture": "arm64",
    "capabilities": [],
    "libc": "glibc",
    "os": "linux",
    "runtimes": { "node": "24" },
    "variables": {}
  }
}
